{
  "product": {
    "name": "GlobexAI",
    "version": "9.1.0"
  },
  "artifact": {
    "digest": "sha256:bbb556262212e24830c4e7c0b0a5b01074b4f33fd4924afdeacb8bf30e90ee08",
    "uri": "oci://registry.example/GlobexAI:9.1.0"
  },
  "provenance": {
    "builder_id": "github-actions://example",
    "build_region": "eu-central-1",
    "timestamp": "2026-01-01T20:05:48.615223Z",
    "source_repo": "https://git.example/org/repo",
    "commit": "0ab93e6d"
  },
  "sbom": {
    "format": "cyclonedx-lite",
    "components": [
      {
        "name": "lib0",
        "version": "3.14.34",
        "supplier_jurisdiction": "SG",
        "criticality": "auth",
        "foreign_control_risk": 0.74
      },
      {
        "name": "lib1",
        "version": "0.8.14",
        "supplier_jurisdiction": "EU",
        "criticality": "ui",
        "foreign_control_risk": 0.282
      },
      {
        "name": "lib2",
        "version": "2.2.19",
        "supplier_jurisdiction": "EU",
        "criticality": "auth",
        "foreign_control_risk": 0.775
      },
      {
        "name": "lib3",
        "version": "2.2.27",
        "supplier_jurisdiction": "SG",
        "criticality": "other",
        "foreign_control_risk": 0.104
      },
      {
        "name": "lib4",
        "version": "2.20.45",
        "supplier_jurisdiction": "EU",
        "criticality": "other",
        "foreign_control_risk": 0.351
      },
      {
        "name": "lib5",
        "version": "5.6.46",
        "supplier_jurisdiction": "US",
        "criticality": "auth",
        "foreign_control_risk": 0.063
      },
      {
        "name": "lib6",
        "version": "5.8.27",
        "supplier_jurisdiction": "EU",
        "criticality": "other",
        "foreign_control_risk": 0.157
      },
      {
        "name": "lib7",
        "version": "5.12.10",
        "supplier_jurisdiction": "EU",
        "criticality": "auth",
        "foreign_control_risk": 0.717
      },
      {
        "name": "lib8",
        "version": "1.0.37",
        "supplier_jurisdiction": "EU",
        "criticality": "other",
        "foreign_control_risk": 0.222
      },
      {
        "name": "lib9",
        "version": "0.10.4",
        "supplier_jurisdiction": "IN",
        "criticality": "auth",
        "foreign_control_risk": 1.0
      },
      {
        "name": "lib10",
        "version": "2.5.4",
        "supplier_jurisdiction": "IN",
        "criticality": "crypto",
        "foreign_control_risk": 0.967
      },
      {
        "name": "lib11",
        "version": "5.9.15",
        "supplier_jurisdiction": "US",
        "criticality": "crypto",
        "foreign_control_risk": 0.069
      },
      {
        "name": "lib12",
        "version": "3.13.1",
        "supplier_jurisdiction": "CN",
        "criticality": "auth",
        "foreign_control_risk": 0.843
      },
      {
        "name": "lib13",
        "version": "2.2.40",
        "supplier_jurisdiction": "CN",
        "criticality": "auth",
        "foreign_control_risk": 0.594
      },
      {
        "name": "lib14",
        "version": "5.8.0",
        "supplier_jurisdiction": "US",
        "criticality": "network",
        "foreign_control_risk": 0.182
      },
      {
        "name": "lib15",
        "version": "4.14.20",
        "supplier_jurisdiction": "US",
        "criticality": "network",
        "foreign_control_risk": 0.086
      },
      {
        "name": "lib16",
        "version": "0.9.20",
        "supplier_jurisdiction": "CN",
        "criticality": "crypto",
        "foreign_control_risk": 0.901
      },
      {
        "name": "lib17",
        "version": "4.2.46",
        "supplier_jurisdiction": "IN",
        "criticality": "data",
        "foreign_control_risk": 0.713
      },
      {
        "name": "lib18",
        "version": "2.4.43",
        "supplier_jurisdiction": "BR",
        "criticality": "data",
        "foreign_control_risk": 0.548
      },
      {
        "name": "lib19",
        "version": "0.17.40",
        "supplier_jurisdiction": "EU",
        "criticality": "network",
        "foreign_control_risk": 0.739
      },
      {
        "name": "lib20",
        "version": "5.15.44",
        "supplier_jurisdiction": "IN",
        "criticality": "other",
        "foreign_control_risk": 0.251
      },
      {
        "name": "lib21",
        "version": "0.9.44",
        "supplier_jurisdiction": "CA",
        "criticality": "auth",
        "foreign_control_risk": 0.867
      },
      {
        "name": "lib22",
        "version": "5.0.46",
        "supplier_jurisdiction": "IN",
        "criticality": "ui",
        "foreign_control_risk": 0.384
      },
      {
        "name": "lib23",
        "version": "3.8.8",
        "supplier_jurisdiction": "SG",
        "criticality": "network",
        "foreign_control_risk": 0.695
      },
      {
        "name": "lib24",
        "version": "3.8.43",
        "supplier_jurisdiction": "US",
        "criticality": "other",
        "foreign_control_risk": 0.113
      },
      {
        "name": "lib25",
        "version": "3.1.12",
        "supplier_jurisdiction": "IN",
        "criticality": "network",
        "foreign_control_risk": 0.645
      },
      {
        "name": "lib26",
        "version": "0.11.0",
        "supplier_jurisdiction": "SG",
        "criticality": "data",
        "foreign_control_risk": 0.499
      },
      {
        "name": "lib27",
        "version": "5.2.24",
        "supplier_jurisdiction": "IN",
        "criticality": "crypto",
        "foreign_control_risk": 1.0
      },
      {
        "name": "lib28",
        "version": "3.7.45",
        "supplier_jurisdiction": "CA",
        "criticality": "auth",
        "foreign_control_risk": 0.761
      },
      {
        "name": "lib29",
        "version": "3.4.33",
        "supplier_jurisdiction": "US",
        "criticality": "network",
        "foreign_control_risk": 0.038
      },
      {
        "name": "lib30",
        "version": "3.6.5",
        "supplier_jurisdiction": "SG",
        "criticality": "ui",
        "foreign_control_risk": 0.19
      },
      {
        "name": "lib31",
        "version": "2.20.25",
        "supplier_jurisdiction": "IN",
        "criticality": "ui",
        "foreign_control_risk": 0.205
      },
      {
        "name": "lib32",
        "version": "3.5.46",
        "supplier_jurisdiction": "BR",
        "criticality": "data",
        "foreign_control_risk": 0.606
      },
      {
        "name": "lib33",
        "version": "0.1.10",
        "supplier_jurisdiction": "EU",
        "criticality": "other",
        "foreign_control_risk": 0.182
      },
      {
        "name": "lib34",
        "version": "2.5.18",
        "supplier_jurisdiction": "US",
        "criticality": "ui",
        "foreign_control_risk": 0.034
      },
      {
        "name": "lib35",
        "version": "2.10.17",
        "supplier_jurisdiction": "IN",
        "criticality": "auth",
        "foreign_control_risk": 1.0
      },
      {
        "name": "lib36",
        "version": "5.19.19",
        "supplier_jurisdiction": "US",
        "criticality": "data",
        "foreign_control_risk": 0.047
      },
      {
        "name": "lib37",
        "version": "3.19.36",
        "supplier_jurisdiction": "CN",
        "criticality": "auth",
        "foreign_control_risk": 0.627
      },
      {
        "name": "lib38",
        "version": "0.3.5",
        "supplier_jurisdiction": "BR",
        "criticality": "other",
        "foreign_control_risk": 0.288
      },
      {
        "name": "lib39",
        "version": "2.18.46",
        "supplier_jurisdiction": "IN",
        "criticality": "data",
        "foreign_control_risk": 0.444
      },
      {
        "name": "lib40",
        "version": "4.0.45",
        "supplier_jurisdiction": "SG",
        "criticality": "crypto",
        "foreign_control_risk": 0.931
      },
      {
        "name": "lib41",
        "version": "2.9.13",
        "supplier_jurisdiction": "CA",
        "criticality": "network",
        "foreign_control_risk": 0.723
      },
      {
        "name": "lib42",
        "version": "0.14.14",
        "supplier_jurisdiction": "SG",
        "criticality": "ui",
        "foreign_control_risk": 0.254
      },
      {
        "name": "lib43",
        "version": "3.14.20",
        "supplier_jurisdiction": "CN",
        "criticality": "data",
        "foreign_control_risk": 0.62
      },
      {
        "name": "lib44",
        "version": "0.17.43",
        "supplier_jurisdiction": "US",
        "criticality": "ui",
        "foreign_control_risk": 0.028
      },
      {
        "name": "lib45",
        "version": "3.17.38",
        "supplier_jurisdiction": "EU",
        "criticality": "crypto",
        "foreign_control_risk": 0.895
      },
      {
        "name": "lib46",
        "version": "0.19.17",
        "supplier_jurisdiction": "IN",
        "criticality": "auth",
        "foreign_control_risk": 0.594
      },
      {
        "name": "lib47",
        "version": "5.9.3",
        "supplier_jurisdiction": "US",
        "criticality": "network",
        "foreign_control_risk": 0.112
      },
      {
        "name": "lib48",
        "version": "1.20.4",
        "supplier_jurisdiction": "US",
        "criticality": "data",
        "foreign_control_risk": 0.086
      },
      {
        "name": "lib49",
        "version": "3.12.37",
        "supplier_jurisdiction": "BR",
        "criticality": "crypto",
        "foreign_control_risk": 1.0
      },
      {
        "name": "lib50",
        "version": "0.15.43",
        "supplier_jurisdiction": "CN",
        "criticality": "network",
        "foreign_control_risk": 0.548
      },
      {
        "name": "lib51",
        "version": "3.18.26",
        "supplier_jurisdiction": "CN",
        "criticality": "data",
        "foreign_control_risk": 0.632
      },
      {
        "name": "lib52",
        "version": "0.20.8",
        "supplier_jurisdiction": "IN",
        "criticality": "auth",